{
  "clientId": "internal-portfolio-francisco",
  "displayName": "Francisco Cruz — Analytics Engineer & Frontend Developer",
  "customDomain": "isfranciscocruz.com",
  "swaResourceName": "swa-portfolio-francisco",
  "template": "portfolio-minimal",
  "features": {
    "blog": false,
    "booking": false,
    "gallery": false,
    "menu": false
  },
  "theme": {
    "preset": "modern-minimal",
    "pageInset": {
      "mobile": "20px",
      "desktop": "0px"
    },
    "sectionSpacing": { "mobile": "2.5rem", "desktop": "6rem" },
    "contentGap":    { "mobile": "0.75rem", "desktop": "1.5rem" }
  },
  "siteMetadata": {
    "siteName": "Francisco Cruz",
    "titleTemplate": "%s | Francisco Cruz",
    "defaultDescription": "Analytics Engineer & Frontend Developer con 6+ años de experiencia construyendo arquitecturas de datos escalables para empresas como Abercrombie & Fitch, Toyota y Whirlpool.",
    "defaultOgImage": null
  },
  "header": {
    "logo": "Francisco Cruz",
    "ctaAction": "/contact",
    "links": [
      { "label": "Success Cases", "href": "/success-cases" },
      { "label": "Contact", "href": "/contact" }
    ]
  },
  "footer": {
    "copyright": "© 2026 Francisco Cruz. All rights reserved.",
    "columns": [
      {
        "title": "Navigation",
        "links": [
          { "label": "Home", "href": "/" },
          { "label": "Success Cases", "href": "/success-cases" },
          { "label": "Contact", "href": "/contact" }
        ]
      },
      {
        "title": "Contact",
        "links": [
          { "label": "francisco.cruz.contact@gmail.com", "href": "mailto:francisco.cruz.contact@gmail.com" }
        ]
      }
    ]
  }
}
